,common_entity,entity1,entity2,entity3,entity4
560,True Green Kids: 100 Things You Can Do to Save the Planet,"Mckay, Kim, Bonnin, Jenny, and De Rothschild, David (FRW)",September,2008,National Geographic Kids
561,The Coming Conflict with China,"Bernstein, Richard and Munro, Ross H.",February,1998,Vintage
562,The Frequency of Souls,"Zuravleff, Mary Kay",April,1996,Farrar Straus Giroux
563,Where She Came From: A Daughter's Search for Her Mother's History,"Epstein, Helen",November,1998,Holmes and Meier edition
564,Match Wits with Mensa®: Test Your Trivia Smarts,"Gordon, Peter",September,2004,Sterling
565,Partnerships for Profit: Structuring and Managing Strategic Alliances,"Lewis, Jordan D.",April,1990,Free Press
566,The Reluctant Belligerent: American Entry Into World War II,"Divine, Robert A",July,1979,McGraw-Hill College
567,Scarlet Feather,"Binchy, Maeve",January,2001,Dutton Adult
568,Bech: a Book,"Updike, John",January,1970,Knopf
569,The Girl with the Golden Gun,"Major, Ann",October,2005,MIRA
570,A Christmas Treasury,"Elder, Sam",January,1985,HarperCollins Publishers
571,The Elements of Feng Shui,Man-Ho Kwok,January,1997,Barnes & Noble
572,Awesome Facts About Sharks,"Llewellyn, Claire",January,2004,Flying Frog Publishing
573,The Gift of Asher Lev,"Potok, Chaim",June,1991,Fawcett
574,Zen for Americans,"Shaku, Soyen",August,1989,Metro Books
575,Quintessence,"Edwards, Owen and Cornfeld, Betty",February,1983,Three Rivers Press
576,The Way Home,"Rossiter, Nan Parson",September,1999,Dutton Books for Young Readers
577,Dream Makers: UntamedLess Of A Stranger,"Roberts, Nora",October,2006,Silhouette
578,Jericho's Fall,"Carter, Stephen L.",July,2009,Knopf
579,Stones from the River,"Hegi, Ursula",April,1995,Scribner
580,Icky Bug Shapes,"Pallotta, Jerry and Bersani, Shennen (ILT)",April,2004,"Scholastic, Inc."
581,The Deity Formerly Known as God,"Stevens, Jarrett",August,2006,Zondervan
582,Friendship 911 Helping Friends Who Struggle With Life's Toughest Issues,"McDowell, Josh, Hostetler, Bob, and Bellis, Dave",July,2000,Thomas Nelson Publishers
583,Halliwell's Film Guide,"Walker, James",January,1992,HarperCollins Publishers
584,A River Town,"Keneally, Thomas",May,1996,Plume
585,The Little Engine That Could,"Piper, Watty and Smouse, Phil A. (ILT)",December,2002,"Barbour Publishing, Incorporated"
586,The Wild Christmas Reindeer,"Brett, Jan",November,1990,G.P. Putnam's Sons Books for Young Readers
587,The Virgin of Small Plains: A Novel of Suspense,"Pickard, Nancy",April,2006,Ballantine Books
588,Fete Fatale,"Barnard, Robert",November,1985,Scribner
589,Computer Wars: The Fall of IBM and the Future of Western Technology,"Morris, Charles R. and Ferguson, Charles H.",February,1993,Crown
590,The Gift of Nothing,"McDonnell, Patrick",October,2005,"Little, Brown Books for Young Readers"
591,How to Use Qualitative Methods in Evaluation,"Patton, Michael Quinn",December,1987,"SAGE Publications, Inc"
592,Litanies and Other Prayers for the Revised Common Lectionary Year B,"Cole, Phyllis and Tilson, Everett.",August,1993,Abingdon Press
593,Low Back Pain Syndrome,"Cailliet, Ren'e",January,1968,"Davis, Fa Co"
594,Keep It Simple,"Burros, Marian",May,1981,William Morrow & Co
595,The Cat Owner's Manual,"Allan, Eric and Bonning, Lynda",May,1994,Random House Value Publishing
596,Nice Work If You Can Get It: My Life in Rhythm and Rhyme,"Feinstein, Michael",October,1995,Hyperion
597,Seducing the Duchess,"March, Ashley",October,2010,Berkley
598,A More Perfect Constitution: Why the Constitution Must Be Revised: Ideas to Inspire a New Generation,"Sabato, Larry J.",September,2008,Bloomsbury USA
599,Hiking the Big Sur Country: The Ventana Wilderness,"Schaffer, Jeffrey P.",May,1988,Wilderness Pr
600,The Prayer of Jabez: Devotional,"Wilkinson, Bruce and Kopp, David",May,2001,Multnomah Books
601,The College Dorm Survival Guide: How to Survive and Thrive in Your New Home Away from Home,"Devillers, Julia",May,2006,Crown
602,Perfect Women: Hidden Fears of Inadequacy and the Drive to Perform,"Dowling, Colette",September,1988,Summit Books
603,Beauty from Ashes,"Price, Eugenia",June,1996,St. Martin's Paperbacks
604,Janet's Horses,"Denton, Kady MacDonald",March,1991,Clarion Books
605,Unlikely Friendships: 47 Remarkable Stories from the Animal Kingdom,"Holland, Jennifer S.",June,2011,Workman Publishing Company
606,No Second Chance,"Coben, Harlan",April,2003,Dutton Adult
607,Steel Guitar,"Barnes, Linda",December,1992,Dell
608,Pippi in the South Seas,"Lindgren, Astrid",January,1974,Scholastic
609,Letters from Vatican City,"Rynne, Xavier",January,1963,"Farrar, Straus & Company"
610,52 Dates for You and Your Mate,"Arp, Dave and Arp, Claudia",January,1993,Thomas Nelson Inc
611,What Research Has to Say About Reading Instruction,"Farstrup, Alan E. (EDT), Samuels, S. Jay (EDT), and Samuels, Jay (EDT)",March,2002,International Reading Association
612,The Darwin Awards Evolution In Action,"Norcutt, Wendy.",January,2000,Dutton Books
613,Bush on the Couch: Inside the Mind of the President,"Frank, Justin A.",July,2005,Harper Perennial
614,Model Railroads,"Freezer, Cyril",November,1991,Courage Books
615,Sixth Sense: Including the Secrets of the Etheric Subtle Body,"Wilde, Stuart",March,2000,Hay House
616,Miss Manners' Guide to Excruciatingly Correct Behavior: The Ultimate Handbook on Modern Etiquette,"Martin, Judith and Kamen, Gloria (ILT)",March,1997,Bbs Pub Corp
617,Cats: An Owner's Guide,"Atkins, Carla, Fresak, Nikki (PHT), and Robinson, Alan (PHT)",October,2003,Thunder Bay Pr
618,Murder Most,"Greenberg, Martin H., Et. Al. (Edited by)",January,2005,Gramercy Books
619,1000 Classic Recipes: The Complete Cookbook for Every Meal and Any Occasion,,January,1999,Anness
620,Hurry Down Sunshine: A Memoir,"Greenberg, Michael",September,2008,Other Press
621,Pain: The Challenge and the Gift,"Matthews, Marti Lynn",September,1991,Stillpoint Pub
622,The Erotic Secrets of a French Maid,"Cach, Lisa",February,2007,Gallery Books
623,Precious Moments of Christmas: Nine Stories that Celebrate the Season,"Butcher, Samuel J. (ILT) and Wiersma, Debbie Butcher",August,1990,Golden Books
624,Gone But Not Forgotten,"Fox-Sheinwold, Patricia",December,1988,Random House Value Publishing
625,The Wishing Horse of Oz,L. Frank Baum,January,1935,Reilly & Lee
626,Holistic Medicine: A Meeting of East and West,"Altenberg, Henry Edward",June,1998,Japan Pubns
627,The Moon and Sixpence,W Somerset Maugham,May,1977,Penguin Books
628,The Tribute: What Every Parent Longs to Hear,"Rainey, Dennis and Boehi, David",April,1994,Thomas Nelson Inc
629,The Q Document: A Novel,"Roberts, James Hall",January,1964,William Morrow and Company
630,How Sweet It Is,"Wisler, Alice J.",May,2009,Bethany House
631,The Pain and the Privilege: Diary of a City Priest,"Gallagher, Joseph",September,1983,Doubleday
632,Shadowfires,"Koontz, Dean R.",August,2008,Berkley
633,The Silken Web,"Brown, Sandra",October,1993,Grand Central Publishing
634,The Demon of Scattery,"Poul Anderson, Mildred Downey Broxon",June,1980,Ace Books
635,Dragon Lady: The Life and Legend of the Last Empress of China,"Seagrave, Sterling and Seagrave, Peggy",August,1993,Vintage
636,Venus Envy,"Brown, Rita Mae",January,1994,Bantam
637,One Police Plaza,"Caunitz, William J.",August,1986,Random House Value Publishing
638,The Homocysteine Revolution: Medicine for the New Millennium,"McCully, Kilmer S.",June,1997,Keats Pub
639,Nightline:: History in the Making and the Making of Television,"Koppel, Ted and Gibson, Kyle",May,1996,Crown
640,Cooks Quotations: A Collection of Fine Paintings and the Best Cooking Quotes,Helen Exley,January,1994,Exley Publications
641,Must Love Shoes: A Collection of Stories About Life in a Woman's Shoes,Julie Gaver,December,2009,Ruby Slipper Publishers
642,Who Will Run The Frog Hospital?,"Moore, Lorrie",September,1994,Alfred A. Knopf
643,The Zen of CSS Design: Visual Enlightenment for the Web,"Holzschlag, Molly E. and Shea, Dave",February,2005,Peachpit Pr
644,Mercy: A Novel,"Picoult, Jodi",April,2001,Washington Square Press
645,Sisters and Brothers: Sibling Relationships in the Animal World,"Page, Robin and Jenkins, Steve",April,2008,HMH Books for Young Readers
646,Embattled Confederates: An Illustrated History of Southerners at War,Wiley,January,1977,Outlet
647,Blow Fly,"Cornwell, Patricia Daniels",October,2003,Putnam
648,After,"Efaw, Amy",August,2009,Viking Books for Young Readers
649,Gates of Mitzvah: Shaarei Mitzvah: A Guide to the Jewish Life Cycle,"Maslin, Simeon J. (EDT)",September,1986,CCAR Press
650,Exploding the myths that could destroy America,"Lutzer, Erwin W.",January,1986,Moody Press
651,Ring of Truth,"Pickard, Nancy",June,2001,Atria
652,Mystic Tide,Angela Dorsey,January,2007,Pony
653,Displaying Australia and New Guinea,"Fox, Matt J",January,1945,Australia Story Trust
654,Sunset Boulevard: From Movie to Musical,"Perry, George C.",November,1993,Henry Holt & Co
655,Zoology,"Dolnick, Ben",May,2007,Vintage
656,Building Your Baby's Brain: A Parent's Guide to the First Five Years,"Dodge, Diane Trister and Heroman, Cate",January,1999,Wadsworth Pub. Co
657,Brand Warfare: 10 Rules for Building the Killer Brand,"D'Alessandro, David F. and Owens, Michele",March,2001,McGraw Hill
658,There's a Dead Person Following My Sister Around,"Vande Velde, Vivian",August,2001,Puffin
659,Radical Gratitude: Discovering Joy through Everyday Thankfulness,"Vaughn, Ellen Santilli",March,2005,Zondervan
660,Love for a Lifetime: Building a Marriage That Will Go the Distance,"Dobson, James C.",February,1993,Multnomah
661,Garden Color Book,"Williams, Paul",April,2000,Chronicle Books
662,The Possible She,"Jacoby, Susan",March,1979,Farrar Straus & Giroux
663,The Ultimate Frankenstein: New Stories by Some of the World's Leading Authors,"Preiss, ron, Keller, David, Miller, Megan, and Betancourt, John (EDT)",September,1991,Dell
664,The uncommon cookbook,"Mellinkoff, Ruth",January,1968,W. Ritchie Press
665,Second Draft of My Life: A Novel,"Lewis, Sara",April,2002,Atria
666,Love of Labs: The Ultimate Tribute to Labrador Retrievers,"Berger, Todd R. (EDT)",June,1999,Marboro Books
667,The Female Advantage: Women's Ways of Leadership,"Helgesen, Sally",April,1990,Currency/ Doubleday
668,Home from Nowhere: Remaking Our Everyday World for the 21st Century,"Kunstler, James Howard",March,1998,Touchstone Press
669,Dinosaur Brains: Dealing With All the Impossible People at Work,"Bernstein, Albert J.",February,1992,Ballantine Books
670,Longarm 018: Yellowstone,"Evans, Tabor",March,1980,Jove
671,Handbook for Writers,"Millward, C. M.",January,1983,Holt; Rinehart; Winston
672,The Soviet Crucible: Soviet Government in Theory and Practice,Samuel (Edited by) Hendel,January,1959,D. Van Nostrand Co
673,In Search of Love and Beauty,"Jhabvala, Ruth Prawer",June,1983,William Morrow & Co
674,Innocent in Death,"Robb, J. D.",February,2007,G.P. Putnam's Sons
675,The Street Lawyer: A Novel,"Grisham, John",February,1998,Doubleday
676,House of Gold,"Macfarlane Jr., Bud",June,1999,Saint Jude Media
677,Thunder in the Desert,"Blackwell, James",September,1991,Bantam
678,Tiptionary,"Hunt, Mary",November,1997,GuildAmerica Books
679,Houdinis Escapes,Walter B. Gibson,March,1977,Bantam Bks.
680,Slowness: A Novel,"Kundera, Milan and Asher, Linda (TRN)",April,1997,Harper Perennial
681,The Leadership Engine,"Tichy, Noel M. and Cohen, Eli B.",August,2002,Harper Business
682,The Prentice Hall Encyclopedia of Garden Flowers,"Pereire, Anita",June,1989,Prentice Hall Direct
683,The assertive woman,"Phelps, Stanlee, Austin, Nancy",January,1975,Impact Publishers
684,The Wonderful Crisis of Middle age: Some Personal Reflections,"Leshan, Eda",June,1976,Warner Books
685,Fireside,"Summer Rain, Mary",May,1998,Hampton Roads Publishing
686,Spiritual Economics: The Prosperity Process,"Butterworth, Eric",June,1983,United Artists Music & Records
687,Designing Storage Area Networks,"Clark, Tom",September,1999,Addison-Wesley Professional
688,Understanding the Enneagram: The Practical Guide to Personality Types,"Riso, Don Richard",February,1990,Houghton Mifflin Harcourt
689,How Did You Get This Number,"Crosley, Sloane",May,2011,Riverhead Books
690,The Book of Calm,Time-Life Books,September,1997,Time Life Education
691,John Clancy's Christmas Cookbook,"Clancy, John",February,1986,Hearst Books
692,Mary Ellen's Best of Helpful Hints Book II,Pinkham,June,1989,Grand Central Pub
693,I'll See You in the Morning,"Jolley, Mike and Moriuchi, Mique (ILT)",July,2005,Chronicle Books
694,Graffiti Girl,"Parra, Kelly",May,2007,MTV Books
695,Murder at the Opera: A Capital Crimes Novel,"Truman, Margaret",November,2006,Ballantine Books
696,How to Be Happier Day by Day,"Epstein, Alan",January,1993,Viking Adult
697,Electronic Commerce: A Managerial Perspective,"Turban, Efraim (EDT), King, David, Lee, Jae Kyu, and Chung, H. Michael",October,1999,Prentice Hall
698,Ransom,"Steel, Danielle",February,2004,Delacorte Press
699,The Corset Diaries,"MacAlister, Katie",May,2004,Berkley
700,Peony in Love: A Novel,"See, Lisa",June,2007,Random House
701,Oxford Blood,"Fraser, Antonia",August,1985,W W Norton & Co Inc
702,Hand of Providence: The Strong and Quiet Faith of Ronald Reagan,"Brown, Mary Beth",March,2004,Thomas Nelson Inc
703,Heirs of the Fisherman: Behind the Scenes of Papal Death and Succession,"Pham, John-Peter",November,2004,Oxford University Press
704,Reach Everyone You Teach,"Rosann Englebretson, Marlene LeFever, Steve Wamberg",January,1998,David C.Cook Church Ministries
705,The World Record Paper Airplane Book,"Blackburn, Ken and Lammers, Jeff",January,1994,Workman Publishing Company
706,The Rottweiler,"Rendell, Ruth",November,2004,Crown
707,The Color of Night,"Lindsey, David L.",April,1999,Grand Central Publishing
708,Sister Wendy's Meditations on Love,"Beckett, Wendy",September,1995,DK
709,The Secret Country,"Dean, Pamela",May,1985,Ace
710,Book of the Dead,"Cornwell, Patricia Daniels",October,2007,G.P. Putnam's Sons
711,Helping Children Learn Mathematics,"Reys, Robert E., Suydam, Marilyn N., and Lindquist, Mary M.",October,1994,Allyn & Bacon
712,Scholastic Reader Level 1: Whales and Dolphins,"Schwartz, Carol (ILT), Roop, Peter, and Roop, Connie",May,2002,Cartwheel
713,The Baronet's Song,"MacDonald, George",May,1983,Bethany House Publishers
714,Shadow Patriots: A Novel of the Revolution,"Robson, Lucia St. Clair",May,2005,Forge Books
715,Slipcover Magic,"Hall, Dorothea (EDT)",February,1995,Chilton Book Co
716,Battle Born,"Brown, Dale",November,1999,Bantam
717,Nuclear Terrorism: The Ultimate Preventable Catastrophe,"Allison, Graham T.",August,2005,Holt Paperbacks
718,Murder With Muskets,"Reeves, John",June,1985,Doubleday
719,Let Go of Clutter,Harriet Schechter,January,2001,McGraw Hill
720,Going to Extremes,"McGinniss, Joe",September,1989,Plume
721,Sara's Song,"Michaels, Fern",March,1998,Zebra
722,The Sample Survey: Theory and Practice,"Warwick, Donald P. and Lininger, C. A.",October,1975,McGraw-Hill
723,Apparitions at Medjugorje Prolonged: A Merciful Delay for a World in Danger,"Laurentin, Rene",June,1987,Riehle Foundation
724,Intermediate Algebra and Analytic Geometry Made Simple,"Gondin, William R., Ph.D. and Sohmer, Bernard",July,1959,Doubleday
725,PC Annoyances: How to Fix the Most Annoying Things About Your Personal Computer,"Bass, Steve",October,2003,O'Reilly Media
726,Many Servants: An Introduction to Deacons,"Plater, Ormonde",June,1991,Cowley Pubns
727,Contemporary Issues in Leadership,"Taylor, Robert L. (EDT) and Rosenbach, William E. (EDT)",January,2006,Westview Press
728,A Walk to Remember,"Sparks, Nicholas",September,2000,Grand Central Publishing
729,The Boy Who Loved Windows: Opening The Heart And Mind Of A Child Threatened With Autism,"Stacey, Patricia",September,2003,Da Capo Lifelong Books
730,More Joy of Microwaving,Microwave Cooking Institute,October,1988,Prentice Hall Direct
731,Review of Medical Physiology,"Ganong, William F.",April,1991,Appleton & Lange
732,Intelligent Memory: Improve the Memory that Makes You Smarter,"Berger, Lisa and Gordon, Barry",September,2003,Viking Adult
733,Nato: The Challenge of Change,Jeffery Simon,January,1993,National Defense Univ. Press Pub.
734,King Edward The Seventh,Philip Magnus,January,1964,E.P. Dutton New York 1964
735,And the Waters Turned to Blood,"Barker, Rodney",March,1998,Simon & Schuster
736,Traditional Family Home Plans,Garlinghouse Company,June,1999,Garlinghouse Co
737,The Two Sides of Love: Using Personality Strengths to Greatly Improve Your Relationships,"Smalley, Gary and Trent, John",January,1999,Living Books
738,Classics of Western philosophy,,January,1990,Hackett
739,What Should I Do with My Life?: The True Story of People Who Answered the Ultimate Question,"Bronson, Po",December,2003,Random House Trade Paperbacks
740,The Apprentice,"Llorente, Pilar Molina and Alonso, Juan Ramon (ILT)",August,1994,Square Fish
741,Southwest Tastes,"Brown, Ellen",January,1991,HP Trade
742,Came the Revolution: Argument in the Reagan Era,"Moynihan, Daniel",March,1988,Harcourt
743,Geraldine's Blanket,Holly Keller,January,1984,Greenwillow Books
744,Maryland in Focus,"Evans, Middleton",October,1988,Middleton Press
745,Modern Trial Advocacy: Analysis and Practice,"Lubet, Steven",November,1997,Natl Inst for Trial Advocacy
746,Our Children Are Dying,"Hentoff, Nat",October,1966,Viking Adult
747,The Monster of Florence,douglas-with-spezi-mario-preston,January,2008,Hachette Book Group USA
748,Answered Prayers: A Novel,"Steel, Danielle",September,2003,Dell
749,Daughters Without Dads,"Rabey, Lois Mowday and Mowday, Lois",February,1990,Thomas Nelson Inc
750,If I Live to Be 100: Lessons from the Centenarians,"Ellis, Neenah",March,2004,Three Rivers Press
751,Food and Wine Annual Cookbook 2010: An Entire Year of Recipes,"Heddings, Kate (EDT)",April,2010,Food & Wine
752,How to Master the Art of Selling,"Hopkins, Tom",June,1988,Warner Books
753,Photography and Your Digital World: The Ultimate Guide to Digital Technology,"Cope, Peter",December,2005,Thunder Bay Press
754,Tears and Laughter in an Israel Courtroom,Shneour Zalman Cheshin,January,1959,Jewish Publication
755,Wealthy and Wise: How You and America Can Get the Most Out of Your Giving,"Rosenberg, Claude, Jr.",September,1994,Little Brown & Co
756,Across Five Aprils,"Hunt, Irene",January,2002,Berkley
757,Discipline Without Shouting or Spanking: Practical Solutions to the Most Common Preschool Behavior Problems,"Wychoff, Jerry and Unell, Barbara C.",November,1984,Da Capo Press
758,Beyond Vietnam: The United States and Asia,"Reischauer, Edwin O.",January,1967,Vintage
759,The New American Story,"Bradley, Bill",January,2008,Random House Trade Paperbacks
760,Spectacular Spiders,Lori C. Froeb,January,2000,Reader's Digest Children's Books
761,Bushworld,"Dowd, Maureen",August,2004,Putnam Adult
762,The Fourth Codex,"Houston, Robert",July,1988,Houghton Mifflin Harcourt
763,Bible Storybook for Toddlers,Carolyn Larsen,January,2006,Creative Edge
764,Redeye,"Aellen, Richard",September,1988,Dutton
765,Fundamentals of Nursing,"Perry, Anne Griffin, Potter, Patricia Ann, Hall, Amy (EDT), Stockert, Patricia A. (EDT), and Baier, Marjorie, Ph.D. (CON)",December,2008,Mosby
766,Shallows of Night,"Lustbader, Eric Van",December,1980,Berkley Books
767,The Executive Life,Editors of Fortune,January,1956,DOLPHIN BOOK/DOUBLEDAY & CO
768,The Secret Circle: The Captive Part II and The Power,"Smith, L. J.",August,2012,HarperTeen
769,Changed Hearts: The Solution to America's Crime Problem,Charles Colson,January,1989,Prison Feellowship Ministries
770,Webster's New World Crossword Puzzle Dictionary,"Whitfield, Jane Shaw",September,1996,Webster's New World
771,Fat Burning Factors Lean Lifestyle,"Sisson, Mark",January,1996,Ultimate Health Publishing
772,Super Ideas for Youth Groups,"Yaconelli, Mike",January,1980,Zondervan
773,Jack's Run,"Smith, Roland",April,2007,Hyperion Books for Children
774,Modern Bridge Conventions,"Root, William S. and Pavlicek, Richard",January,1981,Crown
775,My First Prayers,"Gutmann, Bessie Pease, Akmon, Nancy C., and Akmon, Roni",November,2000,Blushing Rose Pub
776,Larryboy and the Awful Ear Wacks Attacks,"Moore, Michael (ILT) and Katula, Bob",September,2002,ZonderKidz
777,So You're Thinking About Homeschooling: Fifteen Families Show How You Can Do It,"Whelchel, Lisa",March,2003,Multnomah
778,Simple French Cookery,"Beilenson, Edna",January,1958,Peter Pauper Press
779,The Reagan I Knew,"Buckley, William F.",October,2008,Basic Books
780,Jill's Glasses,Nancy Parent,January,2003,Modern Publishing
781,The New Walker's Logbook,Mark Fenton,January,1995,Walking Magazine
782,The Secret Garden,"Burnett, Frances Hodgson",November,1989,Laurel Leaf
783,Cover letters that knock 'em dead,"Yate, Martin",January,1992,Bob Adams
784,Gardener's Book of Needlepoint,"Bodi, Jack",January,1979,Simon & Schuster
785,You Can Draw,"Toll, Damien",February,2006,Hinkler Books
786,Just How Stupid Are We?: Facing the Truth About the American Voter,"Shenkman, Rick",June,2008,Basic Books
787,The Wishbones,"Perrotta, Tom",April,1998,Berkley
788,Healing Through the Power of Prayer: What the Bible Says About Healing,"Dailey, Timothy",January,1998,"Publications International, Ltd."
789,Simply Homemade Food Gifts,"Dahlstrom, Carol Field (EDT), Miller, Jan (EDT), Trollope, Joyce (EDT), Darling, Jennifer Dorland (EDT), and Bander, Susan M. (EDT)",August,2001,Meredith Press
790,Kenya: A Novel,"Halkin, John",July,1986,Beaufort Books
791,The Social Lives of Dogs,"Thomas, Elizabeth Marshall and Williams, Jared Taylor (ILT)",June,2000,Simon & Schuster
792,Eddie's Bastard: A Novel,"Kowalski, William",September,2000,Harper Perennial
793,First Prayers,"Church, Caroline Jayne (ILT)",March,2012,Parragon Books
794,A Speaker's Guidebook,"O'Hair, Dan, Stewart, Robert A., and Rubenstein, Hannah",March,2001,Bedford Books
795,Made in America: His Own Story,"Ueberroth, Peter",May,1988,Horizon Book Promotions
796,The mortgaged heart,"McCullers, Carson",January,1971,Houghton Mifflin
797,Minute Motivators for Leaders: Quick Inspiration for the Time of Your Life,"Toler, Stan",January,2002,David C Cook
798,The Grill Book: New Foods and Flavors for the Grill,"McCune, Kelly",May,1991,HarperCollins
799,Faith,"Deighton, Len",January,1994,HarperCollins
800,Another Mother's Life,"Coleman, Rowan",October,2008,Gallery Books
801,3 Brides for 3 Bad Boys,"Monroe, Lucy",March,2005,Kensington
802,Stops Along the Country Road,"Breighner, Joseph",June,1996,Cathedral Foundation Press
803,What If? Writing Exercises for Fiction Writers,"Bernays, Anne and Painter, Pamela",November,1991,William Morrow Paperbacks
804,The Macmillan Visual Almanac,"Tesar, Jenny E. and Glassman, Bruce S. (EDT)",August,1996,Macmillan General Reference
805,The Great Rift: Africa's Changing Valley,"Smith, Anthony",October,1989,Sterling Pub Co Inc
806,The Secret Diaries of Miss Miranda Cheever,"Quinn, Julia",June,2007,Avon
807,Dear Mother,Hallmark,January,1976,Hallmark Editions
808,The Monkey Handlers,"Liddy, G. Gordon",September,1991,St. Martin's Paperbacks
809,Bread for the World,"Simon, Arthur",March,1985,Eerdmans Pub Co
810,Camera at War: A History of War Photography from 1848 to the Present Day,Jorge Lewinski,April,1980,Simon & Schuster
811,Treasure Island,Robert Louis Stevenson,January,2008,DALMATION PRESS
812,On the Edge of Darkness: Conversations about Conquering Depression,"Cronkite, Kathy",February,1994,Doubleday
813,No Contest : Corporate Lawyers and the Perversion of Justice in America,"Nader, Ralph and Smith, Wesley J.",October,1996,Random House
814,Baseball: Rules of the Game,"Sakurai, Jennifer M. and Dierksen, Jane (ILT)",February,1990,Price Stern Sloan
815,West of Dodge: Frontier Stories  ,"L'Amour, Louis",March,1997,Bantam
816,Before the Wind: True Stories About Sailing,"Gowdey, David (EDT)",February,1994,International Marine/Ragged Mountain Press
817,Cash: An American Man,"Miller, Bill, Vancil, Mark, and Hoye, Jacob",May,2004,CMT
818,Madam Butterfly,"Carner, Mosco",June,1979,Silver Burdett Pr
819,To America: Personal Reflections of an Historian,"Ambrose, Stephen E.",November,2002,Simon & Schuster
820,Twice Shy,"Francis, Dick",January,1983,Fawcett
821,Eloquent Executive,"Parkhurst, William",May,1988,Crown
822,Newt Gingrich's Bedtime Stories for Orphans,"Crimmins, C. E. and Maeder, Tom",July,1995,Newstar Pr
823,Give and Take: The Complete Guide to Negotiating Strategies and Tactics,"Karrass, Chester L.",December,1974,T.Y. Crowell Co
824,Call Each River Jordan: A Novel of Historical Suspense,"Parry, Owen",October,2001,William Morrow
825,Come To Grief,"Francis, Dick",January,1995,Michael Joseph
826,Nonverbal Selling Power,"Gschwandtner, Gerhard and Garnett, Pat",July,1985,Prentice Hall Direct
827,The Snow Garden,"Rice, Christopher",February,2003,Miramax
828,125 Brain Games for Babies,"Silberg, Jackie",May,1999,Gryphon House
829,Rick Steves' Europe Through the Back Door,"Steves, Rick",January,1995,John Muir Pubns
830,American Nature Guides Eastern Birds,"Shaw, Frank",August,1990,Gallery Books
831,The Coyote Bead,"Hausman, Gerald",September,1999,Hampton Roads Publishing
832,Increasing Student Learning Through Multimedia Projects,"Simkins, Michael (EDT)",September,2002,ASCD
833,Dark Age Britain: Some Sources of History,"Marsh, Henry",May,1987,Hippocrene Books
834,ON THE WING: The Life of Birds: From Feathers to Flight,"Brooks, Bruce",September,1989,Scribner
835,BRIGHT STAR,"Coyle, Harold",April,1990,Simon & Schuster
836,Wildcat,"Thomas, Craig",November,1989,Jove
837,Sleeping Beauties: Newborns in Dreamland,"Raver, Tracy (PHT) and Ryden, Kelley (PHT)",March,2010,Sellers Publishing
838,Shadows at Midnight,"Jennings, Elizabeth",August,2010,Berkley
839,How I Pray: People of Different Religions Share with Us That Most Sacred and Intimate Act of Faith,"Castelli, Jim (EDT)",September,1994,Ballantine Books
840,HOLT HANDBOOK 5E,"Kirszner, Laurie G. and Mandell, Stephen R.",January,1999,Wadsworth Publishing
