,common_entity,entity1,entity2,entity3,entity4
1122,The Wordsworth Dictionary of Foreign Words in English,"Ayto, J.",April,1998,Wordsworth Edition
1123,Victory Over the Darkness: Realizing the Power of Your Identity in Christ,"Anderson, Neil T.",July,2000,Baker Pub Group
1124,How Emily Blair Got Her Fabulous Hair,"Priceman, Marjorie (ILT), Beroza, Susan Garrison, and Garrison, Susan",December,1999,Troll Communications
1125,The Lady and the Unicorn: A Novel,"Chevalier, Tracy",December,2004,Penguin Books
1126,Awakening,"Deveraux, Jude",June,1988,Pocket
1127,Workplace 2000: The Revolution Reshaping American Business,"Boyett, Joseph H. and Conn, Henry P.",May,1992,Plume
1128,WWJD Spiritual Challenge Journal,"Yaconelli, Mike",November,1997,Zondervan
1129,Deryni Rising,"Kurtz, Katherine",May,1980,Del Rey
1130,The Joy of Being Single,"Zobel-Nolan, Allia and Chast, Roz (ILT)",January,1992,Workman Publishing Company
1131,Green Frog,Hogeweg,December,1979,Barron's Educational Series
1132,Hemingway's a Farewell to Arms,"Hemingway, Ernest and Sexton, Adam",January,2001,CliffsNotes
1133,Stories for the Family's Heart: Over One Hundred Stories to Encourage Your Soul,"Gray, Alice (EDT)",July,1998,Multnomah
1134,Yurth Burden,"Norton, Andre",September,1978,DAW
1135,The Complete Book of Asian Cooking,,January,2002,New Burlington Books
1136,Nutrition for Dummies,"Rinzler, Carol Ann",April,1997,Hungry Minds Inc
1137,Day After Night: A Novel,"Diamant, Anita",August,2010,Scribner
1138,Old Magic,"Curley, Marianne",February,2002,Simon Pulse
1139,National Geographic: Behind America's Lens on the World,"Abramson, Howard S.",April,1988,Random House Value Publishing
1140,The New Classics: Fresh Ideas for Rooms that Endure,"Trocme, Suzanne, Hayden, Ken (PHT), and Hayden, Ken",October,2002,Harry N. Abrams
1141,The Big Fight: My Life In and Out of the Ring,"Leonard, Sugar Ray and Arkush, Michael (CON)",June,2011,Viking
1142,Reaching to Heaven: A Spiritual Journey Through Life and Death,"Van Praagh, James",February,1999,Dutton
1143,The Romance Reader,"Abraham, Pearl",September,1996,Riverhead Books
1144,Morning Glory,"Peterfreund, Diana",October,2010,Ballantine Books
1145,Housewrights,"Corriveau, Art",June,2002,Penguin Books
1146,Healthy Heart Miracle Diet,"Hastings, John & Lori Mosca",January,2011,The Reader's Digest Associatio
1147,Code Name Ginger: The Story Behind Segway and Dean Kamen's Quest to Invent a New World,"Kemper, Steve",June,2003,Harvard Business Review Press
1148,A Million Little Pieces,"Frey, James",January,2003,Nan A. Talese
1149,Seeking God: My Journey of Prayer and Praise,"Tada, Joni Eareckson",July,1991,Wolgemuth & Hyatt Pub
1150,American Eskimos,Monica Sellers,September,1990,Thomasson Grant & Howell
1151,Latin Quips at Your Fingertips,Rose Williams,January,2001,Barnes & Noble
1152,Journey to the Centre of the Earth,"Verne, Jules",May,1986,Signet Classics
1153,Worst Christmas Ever,"Remlinger-Trounstine, Connie",August,1996,Troll Communications
1154,Hungry as the Sea: A Novel,"Smith, Wilbur A.",May,1999,St. Martin's Paperbacks
1155,Contempt: How the Right Is Wronging American Justice,"Crier, Catherine",September,2005,Rugged Land
1156,Beauty Wisdom: The Secret of Looking and Feeling Fabulous,"Vyas, Bharti and Haggard, Claire",May,1998,Thorsons
1157,The Portable Greek Historians,"Finley, M. I",June,1960,Viking Adult
1158,Circumstances Unknown: A Novel of Suspense,"Heckler, Jonellen",March,1993,Pocket Books
1159,Wealthy and Wise: Secrets About Money,"Steiger, Heidi L. (EDT) and Berman, Neuberger",October,2002,Wiley
1160,British Pottery and Porcelain,"Fisher, Stanley W.",January,1962,Bell Pub. Co.
1161,Adult Children of Divorce,"Hochman, Gloria and Beal, Edward W.",February,1991,Delacorte Press
1162,The Hearse You Came In On,"Cockey, Tim",March,2000,Hachette Books
1163,John James Audubon: The Watercolors for the Birds of America,"New-York Historical Society (COR), Audubon, John James, Stebbins, Theodore E., Jr., Blaugrund, Annette, Slatkin, Carole Anne, and Hotchner, Holly",August,1994,Villard Books
1164,I Do: A Guide to Creating Your Own Unique Wedding Ceremony,"Metrick, Sydney Barbara",September,2004,Celestial Arts
1165,MY WAR,"Rooney, Andrew A.",October,2000,PublicAffairs
1166,Just As I Am: The Life of David Ring As Told to Lela Gilbert,"Gilbert, Lela and Ring, David",September,1993,Moody Pub
1167,The Devil's Waltz,"Stuart, Anne",January,2006,MIRA
1168,A Clear Conscience,"Fyfield, Frances",March,1995,Pantheon Books
1169,The Ride Together: A Brother and Sister's Memoir of Autism in the Family,"Karasik, Judy",January,2003,Washington Square Press
1170,The Meaning of the Constitution,"Holder, Angela Roddey and Holder, John Thomas Roddey",September,1997,Barron's Educational Series
1171,Here at Eagle Pond,"Hall, Donald",January,1992,Houghton Mifflin
1172,Ministry of Intercessory Prayer,"Murray, Andrew",June,1981,Bethany House Pub
1173,The Rebel Bride,"Coulter, Catherine",January,1994,Topaz
1174,The Lost: A Search for Six of Six Million,"Mendelsohn, Daniel and Mendelsohn, Matt (PHT)",September,2006,Harper
1175,May You Be the Mother of a Hundred Sons: A Journey Among the Women of India,"Bumiller, Elisabeth",April,1991,Ballantine Books
1176,The Decorating Book,"Gilliatt, Mary",April,1987,Pantheon
1177,The Case for Christ: A Journalist's Personal Investigation of the Evidence for Jesus,"Strobel, Lee",September,1998,Zondervan
1178,Ink: The Book of All Hours,"Duncan, Hal",February,2007,Del Rey
1179,The Red Hat Society Cookbook: More Than 1000 Recipes From the World's Most Divine Ladies,"The Red Hat Society and intro by Sue Ellen Cooper, illus. by Andrea Reekstin, recipes by members of the Red Hat Society",January,2006,Ruttledge Hill Press
1180,The Book of Grilling and Barbecuing,"Norman, Cecilia",April,1989,HP Trade
1181,The Ends of Power,"Haldeman, H. R.",February,1978,Times Books
1182,The Secret of Annexe 3: An Inspector Morse Mystery,"Dexter, Colin",October,1988,Crimeline
1183,The Seventh Sinner,"Peters, Elizabeth",March,1989,Mysterious Press
1184,Up From Liberalism,"Willaim F. Buckley, Jr.",January,1959,"McDowell, Obolensky"
1185,The Elegant Onion: The Art of Allium Cookery,"Cavage, Betty",October,1987,Garden Way Pub Co
1186,Improving Your Memory: How to Remember What You're Starting to Forget,"Stern, Lynn and Fogler, Janet",April,1994,The Johns Hopkins University Press
1187,UNTIL THE END: A Novel of the Civil War,"Coyle, Harold",September,1996,Simon & Schuster
1188,Best of the Best Fast and Fabulous Party Foods and Appetizers,"Gwen McKee, Barbara Moseley",May,2008,Quail Ridge Press
1189,The Civil War: An Illustrated History,"Ward, Geoffrey C., Burns, Ric, and Burns, Ken",September,1990,Knopf
1190,Leadership for Learning: How to Help Teachers Succeed,"Glickman, Carl D.",January,2002,Association for Supervision & Curriculum Development
1191,Crucified Love,"Maas, Robin",September,1989,Abingdon Press
1192,Gag Rule: On the Suppression of Dissent and Stifling of Democracy,"Lapham, Lewis H.",June,2004,"Penguin Press HC, The"
1193,The New Book Of The Horse: Complete Authoritative Reference for Every Horse Lover,"Haw, Sarah",September,1993,Howell Book House
1194,Sleepless in Scotland,Karen Hawkins,January,2009,Simon and Schuster
1195,Papal Sin: Structures of Deceit,"Wills, Garry",June,2000,Doubleday
1196,The Healthy Heart Gourmet,"Mills, Tom and Mills, Arlene",June,1993,Healthy Heart Gourmet
1197,Against the Tide: How a Compliant Congress Empowered a Reckless President,"Chafee, Lincoln",April,2008,Thomas Dunne Books
1198,What Every American Should Know About American History,"Phillips, Charles and Axelrod, Alan",January,1997,Adams Media
1199,In the Bed of a Duke,"Maxwell, Cathy",April,2006,Avon
1200,United Methodist Altars:A Guide For The Local Church,"Hickman, Hoyt L.",April,1984,Abingdon Press
1201,Twin to Twin,"Courtin, Thierry (ILT) and O'Hair, Margaret",May,2003,Margaret K. McElderry Books
1202,Alphabet Weekends: Love on the Road from A to Z,"Noble, Elizabeth",January,2007,William Morrow Paperbacks
1203,When Your Past Is Hurting Your Present: Getting Beyond Fears That Hold You Back,"Augustine, Sue",August,2005,Harvest House Publishers
1204,Four Trials,"Edwards, John and Auchard, John",November,2003,Simon & Schuster
1205,Sunny Chandler's Return,"Brown, Sandra",December,2003,Bantam
1206,Take It from Me: Life's a Struggle But You Can Win,"Eliot, Marc and Brokovich, Erin",October,2001,McGraw-Hill
1207,Fingerprints and Talking Bones,"Jones, Charlotte Foltz and Klein, David G. (ILT)",February,1999,Yearling
1208,The Serpent Club,"Coffey, Tom",June,1999,Atria
1209,Big Flavors of the Hot Sun: Recipes and Techniques from the Spice Zone,"Schlesinger, Chris, Willoughby, John, and Witschonke, Alan (ILT)",June,1994,William Morrow & Co
1210,Home Hints and Tips,"Richardson, Rosamond and Sadur, Russell (PHT)",February,2003,DK ADULT
1211,Africana,"Harrison, William",January,1977,William Morrow
1212,The Cook's Encyclopedia of Thirty Minute Cooking,Jenni Fleetwood,January,2003,Barnes & Noble Books
1213,In Search of the Birth of Jesus,"Roberts, Paul William",November,1996,Riverhead Trade
1214,Lake News,"Delinsky, Barbara",July,1999,Simon & Schuster
1215,The Cay,"Taylor, Theodore",May,2002,Yearling
1216,Run For Your Life,"Kane, Andrea",November,2000,Pocket
1217,Dad,"Wharton, William",May,1981,Alfred A. Knopf
1218,The New Office Professional's Handbook: How to Survive and Thrive in Today's Office Environment,"American Heritage Dictionaries, Edit (EDT)",January,2009,Houghton Mifflin
1219,Seasons of Our Joy: A Modern Guide to the Jewish Holidays,"Waskow, Arthur I., Farren, Martin, and Benjamin-Farren, Joan",September,1991,Beacon Press
1220,Growing Up Me: A Guide to Scrapbooking Childhood Stories,"Pedersen, Angie",March,2004,Efg Inc
1221,Guide to the Colorado Mountains,"Colorado Mountain Club, Denver",January,1973,Sage
1222,The Actor's Book of Contemporary Stage Monologues: More Than 150 Monologues from More Than 70 Playwrights,"Shengold, Nina (EDT)",November,1987,Penguin Books
1223,The richest lady in town,"Heatherley, Joyce Landorf",January,1979,Bantam Books
1224,Furnish With Fabric: Over 25 Beautiful Ideas For Decorating Your Home,"Guild, Trisha",January,1990,Random House~trade
1225,Tokyo Knights,"Napton, Robert Place and Renegar, Michael",January,2005,Image Comics
1226,In Every Tiny Grain of Sand: A Child's Book of Prayers and Praise,"Jeram, Anita (ILT), Kleven, Elisa (ILT), Graham, Bob (ILT), Davenier, Christine (ILT), and Lindbergh, Reeve (EDT)",August,2000,Candlewick
1227,Favorite Hymns for Children,Karl (Arranger) (Illustrated by Miss Elliott) Schu,January,1942,Grosset & Dunlap
1228,Diablo: My Dream Horse,"Adam, Gabi",January,2005,PONY
1229,Home Masonry Repairs and Projects,Black & Decker,January,1996,QUAYSIDE PUB + CREATIVE PUB
1230,What's the Good Word?,"Safire, William",October,1983,Avon Books
1231,Where Monsoons Cry: stories,"Noronha, Lalita",January,2005,Black Words Inc.
1232,Vox,"Baker, Nicholson",January,1993,Vintage
1233,The Journey of Desire: Searching for the Life We've Only Dreamed of,"Eldredge, John",April,2001,Oliver-Nelson Books
1234,Greatest Ever Baking,unknown,January,2002,Paragon Publishing
1235,Sisters of the Earth: Women's Prose and Poetry About Nature,"Anderson, Lorraine (EDT)",September,1991,Vintage
1236,The Needlepoint Book,"Christensen, Jo Ippolito",January,1976,"Englewood s-20 Prentice-Hall, Inc. 1976."
1237,The Goddess in the Office: A Personal Energy Guide for the Spiritual Warrior at Work,"Budapest, Zsuzsanna Emese",March,1993,HarperOne
1238,The Hamptons Diet: Lose Weight Quickly and Safely with the Doctor's Delicious Meal Plans,"Pescatore, Fred",April,2004,Houghton Mifflin Harcourt
1239,Running Scared: The Life and Treacherous Times of Las Vegas Casino King Steve Wynn,"Smith, John L.",January,2001,Da Capo Press
1240,Spy: The Inside Story of How the FBI's Robert Hanssen Betrayed America,"Wise, David",October,2002,Random House
1241,Better Homes and Gardens Stretching Living Space,Better Homes and Gardens Books (COR),January,1983,Meredith Corp
1242,The Story of the Ten Commandments,"Pingry, Patricia A.",January,2000,WorthyKids
1243,Indochine,"Dickason, Christie",September,1987,Villard
1244,Got Game: How the Gamer Generation Is Reshaping Business Forever,"Beck, John C. and Wade, Mitchell",October,2004,Harvard Business Review Press
1245,The Papa Prayer: The Prayer You've Never Prayed,"Crabb, Lawrence J.",February,2006,Integrity Publishers
1246,River of Light: Monet's Impressions of the Seine,"Monet, Claude and Skeggs, Douglas",September,1987,Knopf
1247,Skippyjon Jones,Judy Schachner,April,2005,Puffin Books
1248,A Kwanzaa Fable,"Copage, Eric V.",October,1995,William Morrow & Co
1249,Elmo Gets Homesick,"Tish Sommers Rabe, Illustrated by Tom Br",January,1990,Golden Pr
1250,Deathbeast,David Gerrold,January,1978,Popular Library
1251,In the Eye of the Storm,"Lucado, Max",July,1991,W Pub Group
1252,The Complete Book of Food Counts,"Netzer, Corinne T.",February,1988,Dell Publishing
1253,Families of Fengsheng,"Sidel, Ruth",November,1974,Penguin Books
1254,Free Yourself from Depression,"Yapko, Michael D.",January,1992,Rodale Pr
1255,Inner Calm: A Christian Answer to Modern Stress,"Deblassie, Paul",March,1985,Liguori Pubns
1256,The Rustlers of West Fork,"L'Amour, Louis",April,1992,Bantam
1257,Children's First Encyclopedia,Neil Morris,January,2004,Backpack Books Inc
1258,Flash and Bones,"Reichs, Kathy",August,2011,Scribner
1259,Technology and the Future,"Teich, Albert H. (EDT)",March,1993,St Martins Pr
1260,Blocking the Courthouse Door: How the Republican Party and Its Corporate Allies Are Taking Away Your Right to Sue,"Mencimer, Stephanie",December,2006,Free Press
1261,Hurricane,"Harper, Karen",May,2006,MIRA
1262,Obama: Why Black America Should Have Doubts,"Owens, William, Jr.",September,2008,Itouchpublishers
1263,Complete Kama Sutra the First Unabridged,"Danielou, Alain",January,1994,Park Street Press
1264,American Psychiatric Press Review of Psychiatry,"Hales, Robert E. (EDT) and Frances, Allen J.",March,1988,Amer Psychiatric Pub Inc
1265,An Encyclopedia of Small Antiques,"MacKay, James A.",July,1975,HarperCollins
1266,A general selection from the works of Sigmund Freud,,January,1957,Doubleday
1267,The Century for Young People,"Armstrong, Jennifer, Jennings, Peter, Brewster, Todd, and Bourbeau, Katherine",September,1999,Doubleday Books for Young Readers
1268,Bears on Wheels,"Berenstain, Stan and Berenstain, Jan",September,1969,Random House Books for Young Readers
1269,Antiques as an Investment,"Rush, Richard H.",January,1968,Bonanza Books
1270,Bright Star Shining: Poems for Christmas,"Harrison, Michael (EDT) and Stuart-Clark, Christopher (EDT)",December,1998,Eerdmans Pub Co
1271,The Woman Next Door,"Delinsky, Barbara",July,2001,Simon & Schuster
1272,The Oxford Dictionary of Foreign Words and Phrases,"Speake, Jennifer (EDT)",December,1998,Oxford University Press
1273,Communication: Key to Your Marriage,"Wright, H. Norman",June,1979,Regal Books
1274,Untamed,"Roberts, Nora",October,2003,Silhouette
1275,My Country 'tis Of Thee,"Smith, Samuel Francis (EDT)",June,2004,Cartwheel
1276,THREAD OF LIFE: The Smithsonian Looks at Evolution,"Lewin, Roger",July,1989,Smithsonian Books
1277,The Wanting,"Black, Campbell",June,1986,McGraw-Hill
1278,Ashana,"Roesch, E. P.",October,1991,Ballantine Books
1279,Girls' Night Out,"Valdes-Rodriguez, Alisa, Giffin, Emily, Gore, Kristin, Bagshawe, Tilly, Matthews, Carole (EDT), Mlynowski, Sarah (EDT), and Manby, Chris (EDT)",May,2006,Red Dress Ink
1280,Curious George and the Firefighters,"Rey, H. A., Rey, Margret, and Hines, Anna Grossnickle (ILT)",August,2004,HMH Books for Young Readers
1281,God's Best for My Life,"Ogilvie, Lloyd J.",January,1981,Harvest House Pub
1282,The Run to Morning,"Higgins, Jack",June,1974,Stein & Day Pub
1283,Wait Till Helen Comes: A Ghost Story,"Hahn, Mary Downing",November,1987,HarperCollins
1284,Decoding The Lost Symbol: The Unauthorized Expert Guide to the Facts Behind the Fiction,"Cox, Simon",November,2009,Atria
1285,The Collected Stories of Amanda Cross,"Cross, Amanda",January,1997,Ballantine Books
1286,Complete Idiot's Guide to Financial Aid for College,"Rye, David",December,2000,Alpha
1287,The Doomsday Key: A Sigma Force Novel,"Rollins, James",June,2009,William Morrow
1288,Movie Book: The 1930's,"Brockman, Alfred",November,1987,Crescent
1289,More Period Details : The House Renovator's Bible,"Miller, Judith",August,1999,Clarkson Potter
1290,The Modern Researcher,"Barzun, Jacques, Graff, Henry F.",September,1985,Harcourt
1291,The Cardinal of the Kremlin,"Clancy, Tom",July,1988,G P Putnam Sons
1292,Father Joe: The Man Who Saved My Soul,"Hendra, Tony",May,2004,Random House
1293,And This Too Shall Pass: A Novel,"Harris, E. Lynn",February,1997,Anchor
1294,The Struggle For A Free Europe,"Acheson, Dean Gooderham",October,1971,W. W. Norton & Company
1295,Wines And Spirits,L. W. MARRISON,January,1958,Pelican
1296,Olive's Ocean,"Henkes, Kevin",April,2005,Greenwillow Books
1297,Official Guide to Colonial Williamsburg,"Olmert, Michael",June,1985,Colonial Williamsburg Foundation
1298,The Farming of Bones,"Danticat, Edwidge",September,1999,Penguin Books
1299,Amazing Grace: 366 Inspiring Hymn Stories for Daily Devotions,"Osbeck, Kenneth W.",July,1990,Kregel Pubns
1300,The Spies of Warsaw: A Novel,"Furst, Alan",June,2008,Random House
1301,When Your Teen Is Struggling: Real Hope and Practical Help for Parents Today,"Gregston, Mark",January,2007,Harvest House Pub
1302,Making Money in Cyberspace,"Edwards, Sarah, Edwards, Paul, and Rohrbough, Linda",September,1998,Tarcher
1303,To My Daughter with Love on the Important Things in Life,"Schutz, Susan Polis, Schutz, Stephen (ILT), and Schutz, Stephen",October,1988,Grand Central Publishing
1304,Finding Facts Fast,"Todd, Alden",October,1979,Ten Speed Pr
1305,The Saturday Evening Post Christmas Book,"Flythe, Starkey and White, Jean",January,1977,The Curtis Publishing Co.
1306,Demanding Medical Excellence: Doctors and Accountability in the Information Age,"Millenson, Michael L.",November,1997,University of Chicago Press
1307,The Poisonwood Bible,Barbara Kingsolver,January,1998,HARPER/COLLINS. NY 1998
1308,How Do Dinosaurs Say Goodnight?,"Yolen, Jane and Teague, Mark (ILT)",March,2000,The Blue Sky Press
1309,Ordinary Resurrections,"Kozol, Jonathan",April,2000,Crown
1310,Day of Wrath: A Mystery,"Collier, Iris",May,2002,Minotaur Books
1311,A New Treasury of Poetry,"Philip, Neil and Lawrence, John (ILT)",September,1990,Stewart Tabori & Chang
1312,Earl Mindell's Supplement Bible,"Mindell, Earl",January,1998,Atria Books
1313,Organizing for Life: Declutter Your Mind to Declutter Your World,"Felton, Sandra",March,2007,Revell
1314,Palinisms: The Accidental Wit and Wisdom of Sarah Palin,"Weisberg, Jacob (EDT)",August,2010,Mariner Books
1315,Riso: Undiscovered Rice Dishes of Northern Italy,"Vitale, Gioietta and Lawley, Lisa",September,1992,Crown
1316,Multicultural Issues in Counseling: New Approaches to Diversity,"Lee, Courtland C. and Richardson, Bernard L. (EDT)",January,1991,Amer Counseling Assn
1317,Howard Hughes: The Untold Story,"Brown, Peter Harry and Broeske, Pat H.",November,2004,Da Capo Press
1318,The Thief and the Dogs,"Mahfouz, Naguib",September,1989,Anchor
1319,Born Wild in Shenandoah,"Simpson, Rob and Simpson, Ann",July,2007,Farcountry Press
1320,Songmaster,Orson Scott Card,January,1980,Dial Press
1321,The Accidental Tourist,"Tyler, Anne",September,1986,Berkley
1322,Real Life: Preparing for the 7 Most Challenging Days of Your Life,"McGraw, Phillip C., Ph.D.",September,2008,Free Press
1323,DK Guide to Space,"Bond, Peter",April,1999,DK Children
1324,Consequences,"Lively, Penelope",May,2007,Viking Adult
1325,The Secret Lives of Doctors' Wives,"Major, Ann",November,2006,MIRA
1326,A History of Warfare,"Keegan, John",November,1994,Vintage
1327,Who Can You Trust?: Overcoming Betrayal and Fear,"Butt, Howard E., Jr.",October,2004,WaterBrook Press
1328,Immortal,"Shields, Gillian",August,2009,Katherine Tegen Books
1329,Special Delivery,"Steel, Danielle",June,1997,Delacorte Press
1330,Exporting America: Why Corporate Greed Is Shipping American Jobs Overseas,"Dobbs, Lou",August,2004,Business Plus
1331,American Diplomacy in the Twentieth Century,"Schulzinger, Robert D.",March,1990,Oxford University Press
1332,Waiting,"Jin, Ha",September,1999,Pantheon Books
1333,Match Me If You Can: A Novel,"Phillips, Susan Elizabeth",August,2005,William Morrow
1334,One Snowy Night,"Macnaughton, Tina (ILT) and Butler, M. Christina",February,2005,Good Books
1335,The Torment of Sherlock Holmes,"Andrews, Val",October,2000,Breese Books Ltd
1336,The Clueless Groom's Guide : More Than Any Man Should Ever Know About Getting Married,"Van Dijk, Peter",May,2003,McGraw-Hill Education
1337,Fresh Flower Arranger's Companion,Andrea Neophyton,May,1994,Booksales
1338,Gertie's Great Gifts,"Perle, Ruth Lerner",January,1990,Grolier Enterprises
1339,Search for a New Dawn,"Delinsky, Barbara",September,1995,HarperTorch
1340,One Hundred Activities for Gifted Children,"Meredith, Paul",June,1957,Lake Pub Co
1341,The Tribe of Tiger: Cats and Their Culture,"Thomas, Elizabeth Marshall and Williams, Jared Taylor (ILT)",September,1995,Simon & Schuster
1342,In Focus: National Geographic Greatest Portraits,"Bendavid-Val, Leah (EDT)",October,2004,National Geographic
1343,Research and Documentation in the Electronic Age,"Hacker, Diana and Fister, Barbara",February,2002,Bedford/St. Martin's
1344,The Many Loves of Marriage,"Kinkade, Thomas, Libby, Larry, and Kinkade, Nanette",December,2001,Multnomah Books
1345,Charming Rabbits,Elinor Cooper,January,1982,TFH Publications
1346,Emeril's Creole Christmas,"Lagasse, Emeril and Bienvenu, Marcelle",October,1997,William Morrow Cookbooks
1347,Dead Pan: A Jocelyn O'Roarke Mystery,"Dentinger, Jane",October,1992,Viking
1348,Swampfire,"Hass, Patricia Cecil",January,1973,"Dodd, Mead"
1349,A Ride into Morning: The Story of Tempe Wick,"Rinaldi, Ann",April,1995,Gulliver Books Paperbacks
1350,Monet,Frank Milner,January,2002,PRC Publishing
1351,Living Religions: A Brief Introduction,"Fisher, Mary Pat",October,2001,Prentice Hall
1352,The Darwin Conspiracy,"Darnton, John",September,2006,Anchor
1353,The Borderlands of Science: Where Sense Meets Nonsense,"Shermer, Michael",November,2002,Oxford University Press
1354,Loving Frank: A Novel,"Horan, Nancy",April,2008,Ballantine Books
1355,SOC,"Witt, Jon",October,2008,McGraw-Hill Humanities/Social Sciences/Languages
1356,Bandits,"Leonard, Elmore",December,1987,William Morrow & Co
1357,Hondo and Fabian,"McCarty, Peter",May,2007,Square Fish
1358,Thanksgiving Is,"Borden, Louise and Bjorkman, Steve (ILT)",October,1997,Cartwheel Books
1359,Annie,"Fleischer, Leonore and Sobieski, Carol",May,1982,Ballantine Books
1360,Working family's kitchen guide,"Kennedy, Sheila",January,1980,distributed to the book trade in the U.S. by Scribner
1361,The City of Gold and Lead,John Christopher,September,1970,Collier Books
1362,Be Like Water: Practical Wisdom from the Martial Arts,"Cardillo, Joseph",September,2003,Warner Books
1363,WW III: Signs of the Impending Battle of Armageddon,"White, John Wesley",March,1977,Zondervan
1364,The Nine: Inside the Secret World of the Supreme Court,"Toobin, Jeffrey",September,2008,Anchor
1365,Civil Disobedience and Violence,"MURPHY, JEFFRIE G (editor)",January,1971,Wadsworth Publishing Co.
1366,Attack and die: Civil War military tactics and the Southern heritage,"McWhiney, Grady",January,1982,The University of Alabama Press
1367,Improve Your Lateral Thinking: Puzzles To Challenge Your Mind,"Sloane, Paul and MacHale, Des",June,1995,Sterling
1368,Weight Watchers Weight Loss That Lasts,"Weight Watchers International and Rippe, James M.",December,2004,Wiley
1369,Ladylord,"Miller, Sasha",January,1997,Tom Doherty Assoc Llc
1370,Stephen Hawking's A Brief History of Time: A Reader's Companion,"Hawking, Stephen W. (EDT)",May,1992,Bantam
1371,The Ultimate Bread,"Collister, Linda & Anthony Blake",January,1999,Shelton Books
1372,Will earns his mark: And other stories of long ago,,January,1994,"Highlights for Children, Inc."
1373,Secrets of the Richest Man Who Ever Lived,"Murdoch, Mike",April,1998,Deborah Murdock Johnson
1374,Constantine the Great the Man and His Times,"Grant, Michael",January,2000,History Book Club
1375,The Ten Commandments,"Macartney, Clarence E. and Szyk, Arthur (ILT)",October,2000,Testament
1376,The Secret of the Bulls,"Bernardo, Jose Raul",March,1996,Simon & Schuster
1377,Hunters Bible,"Merrill, William",November,1968,Doubleday Books
1378,Open Season,"Howard, Linda",June,2002,Pocket Books
1379,The Venture Capital Cycle,"Lerner, Josh and Gompers, Paul A.",February,2002,The MIT Press
1380,Rogue Nation: American Unilateralism And The Failure Of Good Intentions,"Prestowitz, Clyde",May,2004,Basic Books
1381,Celtic Fairy Tales,"Jacobs, Joseph",April,1994,Merchant Book Company Limited
1382,Bankrupt: The Intellectual and Moral Bankruptcy of Today's Democratic Party,"Limbaugh, David",September,2006,Regnery Publishing
1383,Doctor's Book of Food Remedies,"Yeager, Selene",May,2000,Rodale Books
1384,Book of Oriental Carpets and Rugs,"Bennett, Ian",January,1972,Hamlyn Publ Group Ltd
1385,The Debutante,"Bevarly, Elizabeth",November,2005,Silhouette
1386,The Strange Story of the Frog Who Became a Prince,"Horwitz, Elinor Lander",January,1976,"Dell Publishing Co., Inc."
1387,1001 Things Everyone Should Know About the Universe,"Gutsch, William A., Jr.",May,1999,Main Street Books
1388,Once Upon a Marigold,"Ferris, Jean",June,2004,Harcourt Paperbacks
1389,Bookends,"Green, Jane",July,2010,Penguin UK
1390,Super Sandwiches,.,January,2006,"Publications International, Ltd."
1391,Recipe for Life: Feasting on God's Grace,Tim Wesemann,January,2006,"CTA, Inc."
1392,All Dolls Are Collectible,"Angione, Genevieve",December,1988,Crown
1393,The Story of the Erie Canal,R. Conrad Stein,January,1985,Avyx
